### ISSUE TITLE
DLNA TV does not play via local play (upnp) 714 Illegal MIME-type

### ISSUE THREAD

**Issue by kev300** [ampache/ampache#1185]
# Environment
- Ampache version: 3.8.2
- Web server + version: nginx/1.6.2
- Server operating system: Debian 8 (openmediavault 3)
- Client operating system: 
- Client type:
  - [ ] Web
  - [ ] Ampache
  - [ ] SubSonic
  - [ ] Plex
  - [ ] DAAP
  - [x] UPnP
  - [ ] WebDAV
- Client application + version: Panasonic MIL DLNA CP UPnP/1.0 DLNADOC/1.50
# Settings

Enabled local play and added the TV via URL: http://192.168.1.65:55000/dmr/ddd.xml
# Description

The TV can play mp3's when I browse the ampache files from the TV. But when I'm using the web interface and then choose localplay to play a song on the TV, the TV is actually reacting but reports the error message:
File not readable.
# Logs

I have captured the packets via tcpdump and it looks like the TV does not like the MIME-Type?

```
tcpdump -A -s 0 'tcp port 55000 and (((ip[2:2] - ((ip[0]&0xf)<<2)) - ((tcp[12]&0xf0)>>2)) != 0)'
tcpdump: verbose output suppressed, use -v or -vv for full protocol decode
listening on eth0, link-type EN10MB (Ethernet), capture size 262144 bytes
12:59:17.099250 IP NAS.lan.59520 > TV.lan.55000: Flags [P.], seq 1765028687:1765028945, ack 2017885538, win 229, options [nop,nop,TS val 2053840 ecr 291184999], length 258
E..6e.@.@.P........A....i43OxF}b...........
..V..[!gPOST /dmr/control_2 HTTP/1.1
Accept: */*
SOAPACTION: "urn:schemas-upnp-org:service:AVTransport:1#SetAVTransportURI"
CONTENT-TYPE: text/xml; charset="utf-8"
HOST: http://192.168.1.65:55000
Connection: close
Content-Length: 1794
Expect: 100-continue


12:59:18.100570 IP NAS.lan.59520 > TV.lan.55000: Flags [.], seq 258:1706, ack 1, win 229, options [nop,nop,TS val 2054090 ecr 291185020], length 1448
E...e.@.@.K........A....i44QxF}b.....y.....
..W..[!|<?xml version="1.0" encoding="utf-8"?><s:Envelope s:encodingStyle="http://schemas.xmlsoap.org/soap/encoding/" xmlns:s="http://schemas.xmlsoap.org/soap/envelope/"><s:Body>  <u:SetAVTransportURI xmlns:u="urn:schemas-upnp-org:service:AVTransport:1"> <InstanceID>0</InstanceID> <CurrentURI>http://192.168.1.25/play/ssid/6850b5b36155a0518c5acf6efcd9b26a/type/song/oid/4516/uid/2/name/10%20Years%20-%20Wasteland.mp3</CurrentURI> <CurrentURIMetaData>&lt;?xml version=&quot;1.0&quot; encoding=&quot;utf-8&quot;?&gt;
&lt;DIDL-Lite xmlns=&quot;urn:schemas-upnp-org:metadata-1-0/DIDL-Lite/&quot; xmlns:dc=&quot;http://purl.org/dc/elements/1.1/&quot; xmlns:upnp=&quot;urn:schemas-upnp-org:metadata-1-0/upnp/&quot;&gt;
  &lt;item id=&quot;amp://music/songs/4516&quot; parentID=&quot;&quot; restricted=&quot;1&quot;&gt;
    &lt;dc:title&gt;Wasteland&lt;/dc:title&gt;
    &lt;upnp:class&gt;object.item.audioItem.musicTrack&lt;/upnp:class&gt;
    &lt;upnp:albumArtURI&gt;http://192.168.1.25/play/art/6850b5b36155a0518c5acf6efcd9b26a/album/512/thumb.png&lt;/upnp:albumArtURI&gt;
    &lt;upnp:artist&gt;10 Years&lt;/upnp:artist&gt;
    &lt;upnp:album&gt;Killing All That Holds You&lt;/upnp:album&gt;
    &lt;upnp:genre&gt;Industrial&lt;/upnp:genre&gt;
    &lt;upnp:originalTrackNumber&gt;6&lt;/upnp:originalTrackNumber&gt;
    &lt;description&gt;, AG- DA2D482B&lt;/description&gt;
    &lt;res protocolInfo=&quot;http-get:*:audio/mpeg:*&quot; size=&quot;5547494&quot;
12:59:18.100585 IP NAS.lan.59520 > TV.lan.55000: Flags [P.], seq 1706:2052, ack 1, win 229, options [nop,nop,TS val 2054090 ecr 291185020], length 346
E...e.@.@.P:.......A....i49.xF}b.....+.....
..W..[!| duration=&quot;00:03:50.0&quot; bitrate=&quot;192000&quot; sampleFrequency=&quot;44100&quot;&gt;http://192.168.1.25/play/ssid/6850b5b36155a0518c5acf6efcd9b26a/type/song/oid/4516/uid/2/player/api/name/10%20Years%20-%20Wasteland.mp3&lt;/res&gt;
  &lt;/item&gt;
&lt;/DIDL-Lite&gt;
</CurrentURIMetaData>  </u:SetAVTransportURI></s:Body></s:Envelope>
12:59:18.104446 IP TV.lan.55000 > NAS.lan.59520: Flags [P.], seq 1:190, ack 2052, win 4114, options [nop,nop,TS val 291185200 ecr 2054090], length 189
E....Y@.@......A........xF}bi4;S...........
.["0..W.HTTP/1.1 500 Internal Server Error
CONTENT-LENGTH: 490
Content-Type: text/xml; charset="utf-8"
EXT:
SERVER: Panasonic-VIErA/1, UPnP/1.0, Panasonic MIL DLNA SERVER
CONNECTION: close


12:59:18.104484 IP TV.lan.55000 > NAS.lan.59520: Flags [FP.], seq 190:680, ack 2052, win 4114, options [nop,nop,TS val 291185200 ecr 2054090], length 490
E....Z@.@......A........xF~.i4;S...........
.["0..W.<?xml version="1.0" encoding="utf-8"?>
<s:Envelope xmlns:s="http://schemas.xmlsoap.org/soap/envelope/" s:encodingStyle="http://schemas.xmlsoap.org/soap/encoding/">
 <s:Body>
  <s:Fault>
   <faultcode>s:Client</faultcode>
   <faultstring>UPnPError</faultstring>
   <detail>
    <UPnPError xmlns="urn:schemas-upnp-org:control-1-0">
     <errorCode>714</errorCode>
     <errorDescription>Illegal MIME-type</errorDescription>
    </UPnPError>
   </detail>
  </s:Fault>
 </s:Body>
</s:Envelope>

12:59:18.106476 IP NAS.lan.59521 > TV.lan.55000: Flags [P.], seq 1414236396:1414236928, ack 75393256, win 229, options [nop,nop,TS val 2054092 ecr 3857674101], length 532
E..H."@.@..........A....TK...~h............
..W...ouPOST /dmr/control_2 HTTP/1.1
Accept: */*
SOAPACTION: "urn:schemas-upnp-org:service:AVTransport:1#Play"
CONTENT-TYPE: text/xml; charset="utf-8"
HOST: http://192.168.1.65:55000
Connection: close
Content-Length: 310

<?xml version="1.0" encoding="utf-8"?><s:Envelope s:encodingStyle="http://schemas.xmlsoap.org/soap/encoding/" xmlns:s="http://schemas.xmlsoap.org/soap/envelope/"><s:Body>  <u:Play xmlns:u="urn:schemas-upnp-org:service:AVTransport:1"> <InstanceID>0</InstanceID> <Speed>1</Speed>  </u:Play></s:Body></s:Envelope>
12:59:18.815149 IP TV.lan.55000 > NAS.lan.59521: Flags [P.], seq 1:190, ack 532, win 4062, options [nop,nop,TS val 3857674243 ecr 2054092], length 189
E....h@.@......A.........~h.TK......G......
..p...W.HTTP/1.1 500 Internal Server Error
CONTENT-LENGTH: 483
Content-Type: text/xml; charset="utf-8"
EXT:
SERVER: Panasonic-VIErA/1, UPnP/1.0, Panasonic MIL DLNA SERVER
CONNECTION: close


12:59:18.815189 IP TV.lan.55000 > NAS.lan.59521: Flags [FP.], seq 190:673, ack 532, win 4062, options [nop,nop,TS val 3857674243 ecr 2054092], length 483
E....i@.@......A.........~i.TK......p......
..p...W.<?xml version="1.0" encoding="utf-8"?>
<s:Envelope xmlns:s="http://schemas.xmlsoap.org/soap/envelope/" s:encodingStyle="http://schemas.xmlsoap.org/soap/encoding/">
 <s:Body>
  <s:Fault>
   <faultcode>s:Client</faultcode>
   <faultstring>UPnPError</faultstring>
   <detail>
    <UPnPError xmlns="urn:schemas-upnp-org:control-1-0">
     <errorCode>703</errorCode>
     <errorDescription>Read error</errorDescription>
    </UPnPError>
   </detail>
  </s:Fault>
 </s:Body>
</s:Envelope>
```

**Comment by Afterster** [comment]
I will give a try with this server next week.
I believe when this happen, temporary play link (eg. http://192.168.1.25/play/ssid/6850b5b36155a0518c5acf6efcd9b26a/type/song/oid/4516/uid/2/name/10%20Years%20-%20Wasteland.mp3 here) is accessible if you open it directly from your browser?)
Anything on nginx/Ampache logs?

**Comment by kev300** [comment]
Yes, the link is accessible and Firefox downloads the mp3 file.

The TV does not try to access the mp3 file. I've checked the nginx log and there is no http request logged from the TV.

The TV immediatly responses with 714 Illegal MIME-type, so there seem to be an issue within the first xml command from ampache.

**Comment by Phyks** [comment]
@kev300 Do you have the same kind of TV as the above mentionned issue?

Could you try `tcpdump`-ing a working DLNA session (using another streaming software than Ampache), to compare with what Ampache does?

Thanks!

**Comment by kev300** [comment]
Hi, i have the E5 series, ETW-5.
I'll try to do the tcpdump in the next few days, just need to find some time. ;)

**Comment by mitchray** [comment]
Closing due to inactivity
